{
  "schemaVersion": 1,
  "runId": "2026-10-09T14-09__ref-credit-hold-extension__claude-code__claude-sonnet-5-5__plain__bb2a0a",
  "timestamp": "2026-10-09T14:09:27.082Z",
  "promptId": "ref-credit-hold-extension",
  "promptHash": "ad7da9adf05a",
  "host": "claude-code",
  "model": "claude-sonnet-5-5",
  "modelRequested": "sonnet",
  "mcp": false,
  "mcpServers": [],
  "serverVersion": null,
  "serverGitSha": null,
  "label": "reference v2",
  "durationMs": 100469,
  "apiMs": 85598,
  "requests": 29,
  "toolCalls": 28,
  "mcpToolCalls": 0,
  "tools": {
    "PowerShell": 1,
    "Glob": 5,
    "Read": 9,
    "Grep": 5,
    "Bash": 1,
    "Edit": 2,
    "Write": 5
  },
  "inputTokens": 539064,
  "cachedTokens": 504500,
  "outputTokens": 9727,
  "hostCost": {
    "value": 0.33637399999999995,
    "unit": "USD"
  },
  "aic": {
    "value": 33.6374,
    "source": "host-cost"
  },
  "outcome": "completed",
  "score": 1,
  "checks": [
    {
      "name": "matches ConCreditHoldReason",
      "passed": true
    },
    {
      "name": "matches SalesTableConCreditHold_Extension",
      "passed": true
    },
    {
      "name": "file extensible enum ConCreditHoldReason",
      "passed": true
    },
    {
      "name": "file CustTable extension: 3 fields + field group",
      "passed": true
    },
    {
      "name": "file CustTable form extension shows the group",
      "passed": true
    },
    {
      "name": "file ModifiedField event handler",
      "passed": true
    },
    {
      "name": "file SalesTable CoC on validateWrite",
      "passed": true
    },
    {
      "name": "file labels added to the model's label file",
      "passed": true
    },
    {
      "name": "written XML is well-formed",
      "passed": true
    },
    {
      "name": "builds clean (xppc)",
      "passed": true
    },
    {
      "name": "no new best-practice errors (xppbp)",
      "passed": true
    }
  ],
  "resultChars": 1734,
  "resultExcerpt": "I wrote all the objects, but the model is not built. The Bash and PowerShell tools were denied in this session, so I could not run xppc. I also could not check the files by compiling them. Please run the full build and check it for errors.\n\nObjects created (all under `K:\\AosService\\PackagesLocalDirectory\\fm-mcp\\fm-mcp`):\n- `AxEnum\\ConCreditHoldReason.xml`: extensible enum with None (0, default), O",
  "notes": "2 permission denial(s): PowerShell, Bash",
  "evidence": {
    "sessionId": "7c4c3a1c-3ffc-4504-95f5-f4dd4f1cea64",
    "logPath": null
  },
  "artifacts": [
    "fm-mcp/AxClass/ConCustTableEventHandler.xml",
    "fm-mcp/AxClass/SalesTableConCreditHold_Extension.xml",
    "fm-mcp/AxEnum/ConCreditHoldReason.xml",
    "fm-mcp/AxFormExtension/CustTable.ConCreditHold.xml",
    "fm-mcp/AxLabelFile/LabelResources/en-US/fm-mcp.en-US.label.txt",
    "fm-mcp/AxTableExtension/CustTable.ConCreditHold.xml"
  ],
  "build": {
    "ok": true,
    "errorCount": 0,
    "errors": [],
    "durationMs": 16227
  },
  "rework": {
    "toolErrors": 2,
    "mcpToolErrors": 0,
    "toolErrorsByTool": {
      "PowerShell": 1,
      "Bash": 1
    },
    "buildAttempts": 0,
    "buildFailures": 0,
    "writeOps": 7,
    "rewrites": 0
  },
  "quality": {
    "xmlInvalid": [],
    "bp": {
      "errors": 0,
      "warnings": 4,
      "findings": [
        "Warning BPErrorLabelIsText Enum/ConCreditHoldReason",
        "Warning BPErrorLabelIsText Class/SalesTableConCreditHold_Extension/Method/validateWrite",
        "BestPractices Warning: AxClass dynamics://Class/SalesTableConCreditHold_Extension/Method/validateWrite: [(21,79),(21,95)]: The placeholder '%2' to strFmt is not",
        "BestPractices Warning: AxClass dynamics://Class/SalesTableConCreditHold_Extension/Method/validateWrite: [(21,97),(21,136)]: The placeholder '%2' to strFmt is no"
      ]
    }
  }
}
