{
  "schemaVersion": 1,
  "runId": "2026-10-09T16-50__ref-credit-hold-extension__claude-code__claude-sonnet-5-5__plain__a0a84f",
  "timestamp": "2026-10-09T16:50:49.491Z",
  "promptId": "ref-credit-hold-extension",
  "promptHash": "c3ecaa796b4e",
  "host": "claude-code",
  "model": "claude-sonnet-5-5",
  "modelRequested": "sonnet",
  "mcp": false,
  "mcpServers": [],
  "serverVersion": null,
  "serverGitSha": null,
  "label": "v3",
  "durationMs": 199858,
  "apiMs": 92006,
  "requests": 38,
  "toolCalls": 37,
  "mcpToolCalls": 0,
  "tools": {
    "PowerShell": 1,
    "Bash": 8,
    "Read": 5,
    "Grep": 12,
    "Glob": 1,
    "Write": 7,
    "Edit": 3
  },
  "inputTokens": 784019,
  "cachedTokens": 746285,
  "outputTokens": 12448,
  "hostCost": {
    "value": 0.42459699999999995,
    "unit": "USD"
  },
  "aic": {
    "value": 42.4597,
    "source": "host-cost"
  },
  "outcome": "completed",
  "score": 1,
  "checks": [
    {
      "name": "matches ConCreditHoldReason",
      "passed": true
    },
    {
      "name": "matches SalesTableConCreditHold_Extension",
      "passed": true
    },
    {
      "name": "file extensible enum ConCreditHoldReason",
      "passed": true
    },
    {
      "name": "file CustTable extension: 3 fields + field group",
      "passed": true
    },
    {
      "name": "file CustTable form extension shows the group",
      "passed": true
    },
    {
      "name": "file ModifiedField event handler",
      "passed": true
    },
    {
      "name": "file SalesTable CoC on validateWrite",
      "passed": true
    },
    {
      "name": "file labels added to the model's label file",
      "passed": true
    },
    {
      "name": "written XML is well-formed",
      "passed": true
    },
    {
      "name": "builds clean (xppc)",
      "passed": true
    },
    {
      "name": "no new best-practice errors (xppbp)",
      "passed": true
    }
  ],
  "resultChars": 1832,
  "resultExcerpt": "The model builds with 0 errors. I ran the `benchmarkSandboxBuild.mjs` command you gave. I haven't opened the form or placed a test order.\n\nI added labels `ConCreditHoldReason`, `ConCreditHoldReasonHelp`, `ConCreditHoldReasonNone`, `ConCreditHoldReasonOverdueInvoices`, `ConCreditHoldReasonDisputedBalance`, `ConCreditHoldReasonManualReview`, `ConCreditHoldNote`, `ConCreditHoldNoteHelp`, `ConCreditHo",
  "notes": "3 permission denial(s): PowerShell, Bash, Bash",
  "evidence": {
    "sessionId": "e9edaaa0-2063-421c-879a-7417c53f5916",
    "logPath": null
  },
  "artifacts": [
    "fm-mcp/AxClass/ConCustTableEventHandler.xml",
    "fm-mcp/AxClass/SalesTableConCreditHold_Extension.xml",
    "fm-mcp/AxEnum/ConCreditHoldReason.xml",
    "fm-mcp/AxFormExtension/CustTable.ConCreditHold.xml",
    "fm-mcp/AxLabelFile/LabelResources/en-US/fm-mcp.en-US.label.txt",
    "fm-mcp/AxTableExtension/CustTable.ConCreditHold.xml"
  ],
  "build": {
    "ok": true,
    "errorCount": 0,
    "errors": [],
    "durationMs": 17318
  },
  "rework": {
    "toolErrors": 8,
    "mcpToolErrors": 0,
    "toolErrorsByTool": {
      "PowerShell": 1,
      "Bash": 4,
      "Grep": 2,
      "Edit": 1
    },
    "buildAttempts": 3,
    "buildFailures": 2,
    "writeOps": 10,
    "rewrites": 4
  },
  "quality": {
    "xmlInvalid": [],
    "bp": {
      "errors": 0,
      "warnings": 4,
      "findings": [
        "Warning BPErrorLabelIsText Enum/ConCreditHoldReason",
        "Warning BPErrorLabelIsText Class/SalesTableConCreditHold_Extension/Method/validateWrite",
        "BestPractices Warning: AxClass dynamics://Class/SalesTableConCreditHold_Extension/Method/validateWrite: [(17,79),(17,95)]: The placeholder '%2' to strFmt is not",
        "BestPractices Warning: AxClass dynamics://Class/SalesTableConCreditHold_Extension/Method/validateWrite: [(17,97),(17,136)]: The placeholder '%2' to strFmt is no"
      ]
    }
  }
}
