{
  "schemaVersion": 1,
  "runId": "2026-10-09T15-09__daily-invoice-field-flow__claude-code__claude-opus-5-5__plain__6dc0ba",
  "timestamp": "2026-10-09T15:09:46.927Z",
  "promptId": "daily-invoice-field-flow",
  "promptHash": "7767b21431ec",
  "host": "claude-code",
  "model": "claude-opus-5-5",
  "modelRequested": "opus",
  "mcp": false,
  "mcpServers": [],
  "serverVersion": null,
  "serverGitSha": null,
  "label": "v3",
  "durationMs": 111437,
  "apiMs": 82625,
  "requests": 26,
  "toolCalls": 25,
  "mcpToolCalls": 0,
  "tools": {
    "PowerShell": 1,
    "Glob": 2,
    "Read": 9,
    "Grep": 5,
    "Write": 7,
    "Bash": 1
  },
  "inputTokens": 545085,
  "cachedTokens": 511962,
  "outputTokens": 8829,
  "hostCost": {
    "value": 0.5438364,
    "unit": "USD"
  },
  "aic": {
    "value": 54.38364,
    "source": "host-cost"
  },
  "outcome": "completed",
  "score": 1,
  "checks": [
    {
      "name": "matches initFromSalesTable|initFromSalesParmTable|initInvoiceHeaderFromSourceTable|initJournalHeader",
      "passed": true
    },
    {
      "name": "file EDT ConProjectCode, 20 characters",
      "passed": true
    },
    {
      "name": "file SalesTable extension: the field",
      "passed": true
    },
    {
      "name": "file CustInvoiceJour extension: the field",
      "passed": true
    },
    {
      "name": "file SalesTable form extension shows it",
      "passed": true
    },
    {
      "name": "file CustInvoiceJournal form extension shows it",
      "passed": true
    },
    {
      "name": "file CoC on the method that initializes the invoice header",
      "passed": true
    },
    {
      "name": "written XML is well-formed",
      "passed": true
    },
    {
      "name": "builds clean (xppc)",
      "passed": true
    },
    {
      "name": "no new best-practice errors (xppbp)",
      "passed": true
    }
  ],
  "resultChars": 1521,
  "resultExcerpt": "The model builds with zero errors (labels plus xppc full build, run with the exact command you gave).\n\n**Objects created or changed in `fm-mcp`:**\n- `AxEdt\\ConProjectCode`: new string EDT, 20 characters, with a label and a help text from the `fm-mcp` label file.\n- `AxLabelFile` `fm-mcp` (en-US): changed, added the labels `@fm-mcp:ConProjectCode` (\"Project code\") and `@fm-mcp:ConProjectCodeHelp`.\n-",
  "notes": "1 permission denial(s): PowerShell",
  "evidence": {
    "sessionId": "fdd8d411-5915-4ed9-ab86-150ac82c7979",
    "logPath": null
  },
  "artifacts": [
    "fm-mcp/AxClass/ConCustInvoiceJour_Extension.xml",
    "fm-mcp/AxEdt/ConProjectCode.xml",
    "fm-mcp/AxFormExtension/CustInvoiceJournal.ConExtension.xml",
    "fm-mcp/AxFormExtension/SalesTable.ConExtension.xml",
    "fm-mcp/AxLabelFile/LabelResources/en-US/fm-mcp.en-US.label.txt",
    "fm-mcp/AxTableExtension/CustInvoiceJour.ConExtension.xml",
    "fm-mcp/AxTableExtension/SalesTable.ConExtension.xml"
  ],
  "build": {
    "ok": true,
    "errorCount": 0,
    "errors": [],
    "durationMs": 16725
  },
  "rework": {
    "toolErrors": 1,
    "mcpToolErrors": 0,
    "toolErrorsByTool": {
      "PowerShell": 1
    },
    "buildAttempts": 1,
    "buildFailures": 0,
    "writeOps": 7,
    "rewrites": 0
  },
  "quality": {
    "xmlInvalid": [],
    "bp": {
      "errors": 0,
      "warnings": 2,
      "findings": [
        "Warning BPErrorHelpIsText EdtString/ConProjectCode",
        "Warning BPErrorLabelIsText EdtString/ConProjectCode"
      ]
    }
  }
}
