{
  "schemaVersion": 1,
  "runId": "2026-10-09T16-01__ref-vendor-certificate-register__claude-code__claude-sonnet-5-5__mcp__576c30",
  "timestamp": "2026-10-09T16:01:02.709Z",
  "promptId": "ref-vendor-certificate-register",
  "promptHash": "274a0c3364a6",
  "host": "claude-code",
  "model": "claude-sonnet-5-5",
  "modelRequested": "sonnet",
  "mcp": true,
  "mcpServers": [
    "d365fo-eval"
  ],
  "serverVersion": "1.20.0",
  "serverGitSha": "ab892668",
  "label": "v3",
  "durationMs": 256300,
  "apiMs": 183448,
  "requests": 56,
  "toolCalls": 55,
  "mcpToolCalls": 2,
  "tools": {
    "PowerShell": 1,
    "Glob": 8,
    "Read": 15,
    "Grep": 9,
    "Bash": 5,
    "Write": 13,
    "ToolSearch": 1,
    "mcp__d365fo-eval__d365fo_file": 2,
    "Edit": 1
  },
  "inputTokens": 1987441,
  "cachedTokens": 1902282,
  "outputTokens": 24062,
  "hostCost": {
    "value": 0.9616043999999999,
    "unit": "USD"
  },
  "aic": {
    "value": 96.16044,
    "source": "host-cost"
  },
  "outcome": "completed",
  "score": 1,
  "checks": [
    {
      "name": "matches ConVendCertificate",
      "passed": true
    },
    {
      "name": "file string EDT ConVendCertificateId",
      "passed": true
    },
    {
      "name": "file extensible enum ConVendCertificateType",
      "passed": true
    },
    {
      "name": "file table: fields, primary index, VendTable relation, find/exist/validateWrite",
      "passed": true
    },
    {
      "name": "file SimpleList form over the table",
      "passed": true
    },
    {
      "name": "file display menu item",
      "passed": true
    },
    {
      "name": "file ProcurementAndSourcing menu extension",
      "passed": true
    },
    {
      "name": "file maintain privilege (delete)",
      "passed": true
    },
    {
      "name": "file view privilege (read only)",
      "passed": true
    },
    {
      "name": "file VendTable form extension opens the register",
      "passed": true
    },
    {
      "name": "file labels added to the model's label file",
      "passed": true
    },
    {
      "name": "written XML is well-formed",
      "passed": true
    },
    {
      "name": "builds clean (xppc)",
      "passed": true
    },
    {
      "name": "no new best-practice errors (xppbp)",
      "passed": true
    }
  ],
  "resultChars": 1663,
  "resultExcerpt": "The `fm-mcp` model builds with 0 errors; I ran the full build (labels and xppc) with the command you gave. The build only compiles. I didn't open the form or the new button, so the vendor filter and the button placement are untested.\n\n- `ConVendCertificateId` (EDT, string 20)\n- `ConVendCertificateType` (extensible enum: Iso9001, Iso14001, FoodSafety, Other)\n- `ConVendCertificate` (table, with the ",
  "notes": "3 permission denial(s): PowerShell, Bash, Bash",
  "evidence": {
    "sessionId": "31c0ea53-e1d4-44fb-a7ae-7fd1fdec35de",
    "logPath": null
  },
  "artifacts": [
    "fm-mcp/AxEdt/ConVendCertificateId.xml",
    "fm-mcp/AxEnum/ConVendCertificateType.xml",
    "fm-mcp/AxForm/ConVendCertificate.xml",
    "fm-mcp/AxFormExtension/VendTable.ConVendCertificate.xml",
    "fm-mcp/AxLabelFile/LabelResources/en-US/fm-mcp.en-US.label.txt",
    "fm-mcp/AxMenuExtension/ProcurementAndSourcing.ConVendCertificate.xml",
    "fm-mcp/AxMenuItemDisplay/ConVendCertificate.xml",
    "fm-mcp/AxSecurityPrivilege/ConVendCertificateMaintain.xml",
    "fm-mcp/AxSecurityPrivilege/ConVendCertificateView.xml",
    "fm-mcp/AxTable/ConVendCertificate.xml"
  ],
  "build": {
    "ok": true,
    "errorCount": 0,
    "errors": [],
    "durationMs": 16155
  },
  "rework": {
    "toolErrors": 6,
    "mcpToolErrors": 0,
    "toolErrorsByTool": {
      "PowerShell": 1,
      "Grep": 1,
      "Bash": 4
    },
    "buildAttempts": 3,
    "buildFailures": 2,
    "writeOps": 14,
    "rewrites": 2
  },
  "quality": {
    "xmlInvalid": [],
    "bp": {
      "errors": 0,
      "warnings": 29,
      "findings": [
        "Warning BPErrorLabelIsText SecurityPrivilege/ConVendCertificateMaintain",
        "Warning BPErrorLabelIsText SecurityPrivilege/ConVendCertificateMaintain",
        "Warning BPErrorPrivilegeNotCoveredByDuty SecurityPrivilege/ConVendCertificateMaintain",
        "Warning BPErrorLabelIsText SecurityPrivilege/ConVendCertificateView",
        "Warning BPErrorLabelIsText SecurityPrivilege/ConVendCertificateView",
        "Warning BPErrorPrivilegeNotCoveredByDuty SecurityPrivilege/ConVendCertificateView",
        "Warning BPErrorHelpIsText EdtString/ConVendCertificateId",
        "Warning BPErrorLabelIsText EdtString/ConVendCertificateId",
        "Warning BPErrorLabelIsText Enum/ConVendCertificateType",
        "Warning BPErrorLabelIsText Form/ConVendCertificate/FormDesign/FormDesign",
        "BestPractices Warning: AxTable dynamics://Table/ConVendCertificate: The index 'VendCertificateIdx' specified as Primary key on table 'ConVendCertificate' is not",
        "Warning BPErrorEDTNotMigrated Table/ConVendCertificate/TableFieldString/VendAccount",
        "Warning BPErrorTableMissingGroupAutoReport Table/ConVendCertificate",
        "Warning BPErrorTableTitleField1NotDeclared Table/ConVendCertificate",
        "Warning BPErrorTablePrimaryKeyEditable Table/ConVendCertificate/TableIndex/VendCertificateIdx/TableIndexField/VendAccount"
      ]
    }
  }
}
