{
  "schemaVersion": 1,
  "runId": "2026-10-10T08-42__ref-overdue-batch-ssrs__claude-code__claude-opus-5-5__plain__423e99",
  "timestamp": "2026-10-10T08:42:27.933Z",
  "promptId": "ref-overdue-batch-ssrs",
  "promptHash": "20ed5d295c76",
  "host": "claude-code",
  "model": "claude-opus-5-5",
  "modelRequested": "opus",
  "mcp": false,
  "mcpServers": [],
  "serverVersion": null,
  "serverGitSha": null,
  "label": "v3",
  "durationMs": 325017,
  "apiMs": 280275,
  "requests": 54,
  "toolCalls": 53,
  "mcpToolCalls": 0,
  "tools": {
    "PowerShell": 4,
    "Glob": 4,
    "Read": 13,
    "Bash": 1,
    "Grep": 11,
    "Write": 11,
    "Edit": 9
  },
  "inputTokens": 3271391,
  "cachedTokens": 3169223,
  "outputTokens": 34344,
  "hostCost": {
    "value": 2.1377566,
    "unit": "USD"
  },
  "aic": {
    "value": 213.77566,
    "source": "host-cost"
  },
  "outcome": "completed",
  "score": 1,
  "checks": [
    {
      "name": "matches ConCustOverdueSnapshotService",
      "passed": true
    },
    {
      "name": "matches ConCustOverdueReport",
      "passed": true
    },
    {
      "name": "file snapshot table",
      "passed": true
    },
    {
      "name": "file SysOperation data contract",
      "passed": true
    },
    {
      "name": "file SysOperation service over CustTransOpen",
      "passed": true
    },
    {
      "name": "file SysOperation controller with main",
      "passed": true
    },
    {
      "name": "file action menu item for the batch job",
      "passed": true
    },
    {
      "name": "file TempDB report table",
      "passed": true
    },
    {
      "name": "file report data contract",
      "passed": true
    },
    {
      "name": "file report data provider",
      "passed": true
    },
    {
      "name": "file report with a DP dataset and a design",
      "passed": true
    },
    {
      "name": "file output menu item for the report",
      "passed": true
    },
    {
      "name": "written XML is well-formed",
      "passed": true
    },
    {
      "name": "builds clean (xppc)",
      "passed": true
    },
    {
      "name": "no new best-practice errors (xppbp)",
      "passed": true
    }
  ],
  "resultChars": 2787,
  "resultExcerpt": "The model builds with zero errors (labels plus a full xppc build).\n\n**Created**\n- `AxTable/ConCustOverdueSnapshot`: the snapshot table. It has the five fields, a unique index `AccountAsOfDateIdx` on AccountNum + AsOfDate (also the primary key and replacement key), a foreign-key relation to CustTable, and `find`/`exist` methods.\n- `AxTable/ConCustOverdueReportTmp`: the TempDB table for the report.\n",
  "notes": "2 permission denial(s): PowerShell, Bash",
  "evidence": {
    "sessionId": "0edf5777-dbb4-4f71-b153-00e3be478fec",
    "logPath": null
  },
  "artifacts": [
    "fm-mcp/AxClass/ConCustOverdueReportContract.xml",
    "fm-mcp/AxClass/ConCustOverdueReportDP.xml",
    "fm-mcp/AxClass/ConCustOverdueSnapshotContract.xml",
    "fm-mcp/AxClass/ConCustOverdueSnapshotController.xml",
    "fm-mcp/AxClass/ConCustOverdueSnapshotService.xml",
    "fm-mcp/AxLabelFile/LabelResources/en-US/fm-mcp.en-US.label.txt",
    "fm-mcp/AxMenuItemAction/ConCustOverdueSnapshot.xml",
    "fm-mcp/AxMenuItemOutput/ConCustOverdueReport.xml",
    "fm-mcp/AxReport/ConCustOverdueReport.xml",
    "fm-mcp/AxTable/ConCustOverdueReportTmp.xml",
    "fm-mcp/AxTable/ConCustOverdueSnapshot.xml"
  ],
  "build": {
    "ok": true,
    "errorCount": 0,
    "errors": [],
    "durationMs": 12880
  },
  "rework": {
    "toolErrors": 4,
    "mcpToolErrors": 0,
    "toolErrorsByTool": {
      "PowerShell": 2,
      "Bash": 1,
      "Grep": 1
    },
    "buildAttempts": 2,
    "buildFailures": 1,
    "writeOps": 20,
    "rewrites": 2
  },
  "quality": {
    "xmlInvalid": [],
    "bp": {
      "errors": 0,
      "warnings": 33,
      "findings": [
        "Warning BPErrorLabelIsText Report/ConCustOverdueReport/ReportDataSet/ConCustOverdueDS/ReportDataSetField/OverdueAmountMST",
        "Warning BPErrorLabelIsText Report/ConCustOverdueReport/ReportDataSet/ConCustOverdueDS/ReportDataSetField/OldestDueDate",
        "Warning BPErrorLabelIsText Report/ConCustOverdueReport/ReportDataSet/ConCustOverdueDS/ReportDataSetField/OpenTransCount",
        "Warning BPErrorMenuItemNotCoveredByPrivilege MenuItemOutput/ConCustOverdueReport",
        "Warning BPErrorHelpIsText MenuItemOutput/ConCustOverdueReport",
        "Warning BPErrorMenuItemNotCoveredByPrivilege MenuItemAction/ConCustOverdueSnapshot",
        "Warning BPErrorHelpIsText MenuItemAction/ConCustOverdueSnapshot",
        "Warning BPErrorEDTNotMigrated Table/ConCustOverdueSnapshot/TableFieldString/AccountNum",
        "Warning BPErrorTableFieldNotDefinedUsingType Table/ConCustOverdueSnapshot/TableFieldInt/OpenTransCount",
        "Warning BPErrorHelpIsText Table/ConCustOverdueSnapshot/TableFieldDate/AsOfDate",
        "Warning BPErrorLabelIsText Table/ConCustOverdueSnapshot",
        "Warning BPErrorLabelIsText Table/ConCustOverdueSnapshot",
        "Warning BPErrorLabelIsText Table/ConCustOverdueSnapshot/TableFieldDate/AsOfDate",
        "Warning BPErrorLabelIsText Table/ConCustOverdueSnapshot/TableFieldReal/OverdueAmountMST",
        "Warning BPErrorLabelIsText Table/ConCustOverdueSnapshot/TableFieldDate/OldestDueDate"
      ]
    }
  }
}
