{
  "schemaVersion": 1,
  "runId": "2026-10-10T08-56__ref-vendor-certificate-register__claude-code__claude-opus-5-5__mcp__4a87b4",
  "timestamp": "2026-10-10T08:56:09.742Z",
  "promptId": "ref-vendor-certificate-register",
  "promptHash": "274a0c3364a6",
  "host": "claude-code",
  "model": "claude-opus-5-5",
  "modelRequested": "opus",
  "mcp": true,
  "mcpServers": [
    "d365fo-eval"
  ],
  "serverVersion": "1.20.0",
  "serverGitSha": "09cbb862",
  "label": "v3",
  "durationMs": 269797,
  "apiMs": 192162,
  "requests": 51,
  "toolCalls": 50,
  "mcpToolCalls": 7,
  "tools": {
    "PowerShell": 1,
    "Glob": 4,
    "Read": 10,
    "Grep": 6,
    "Bash": 6,
    "ToolSearch": 1,
    "mcp__d365fo-eval__get_workspace_info": 1,
    "mcp__d365fo-eval__get_object_info": 2,
    "Write": 13,
    "mcp__d365fo-eval__labels": 1,
    "Edit": 2,
    "mcp__d365fo-eval__object_patterns": 1,
    "mcp__d365fo-eval__d365fo_file": 2
  },
  "inputTokens": 1944675,
  "cachedTokens": 1888690,
  "outputTokens": 22507,
  "hostCost": {
    "value": 1.275486,
    "unit": "USD"
  },
  "aic": {
    "value": 127.5486,
    "source": "host-cost"
  },
  "outcome": "completed",
  "score": 1,
  "checks": [
    {
      "name": "matches ConVendCertificate",
      "passed": true
    },
    {
      "name": "file string EDT ConVendCertificateId",
      "passed": true
    },
    {
      "name": "file extensible enum ConVendCertificateType",
      "passed": true
    },
    {
      "name": "file table: fields, primary index, VendTable relation, find/exist/validateWrite",
      "passed": true
    },
    {
      "name": "file SimpleList form over the table",
      "passed": true
    },
    {
      "name": "file display menu item",
      "passed": true
    },
    {
      "name": "file ProcurementAndSourcing menu extension",
      "passed": true
    },
    {
      "name": "file maintain privilege (delete)",
      "passed": true
    },
    {
      "name": "file view privilege (read only)",
      "passed": true
    },
    {
      "name": "file VendTable form extension opens the register",
      "passed": true
    },
    {
      "name": "file labels added to the model's label file",
      "passed": true
    },
    {
      "name": "written XML is well-formed",
      "passed": true
    },
    {
      "name": "builds clean (xppc)",
      "passed": true
    },
    {
      "name": "no new best-practice errors (xppbp)",
      "passed": true
    }
  ],
  "resultChars": 2264,
  "resultExcerpt": "The model builds with zero errors. I ran `benchmarkSandboxBuild.mjs` at the end and it reported \"Build succeeded in 16 s — 0 errors.\"\n\nObjects created or changed in `fm-mcp`:\n\n- **Label file `fm-mcp` (en-US)** – changed: added all labels used below (field labels, help texts, enum values, privilege names and the error message for the date check).\n- **EDT `ConVendCertificateId`** – created: string, ",
  "notes": "3 permission denial(s): PowerShell, Bash, Bash",
  "evidence": {
    "sessionId": "fb0dfb08-abd9-403b-a60e-72e9bc5b1748",
    "logPath": null
  },
  "artifacts": [
    "fm-mcp/AxEdt/ConVendCertificateId.xml",
    "fm-mcp/AxEnum/ConVendCertificateType.xml",
    "fm-mcp/AxForm/ConVendCertificate.xml",
    "fm-mcp/AxFormExtension/VendTable.ConExtension.xml",
    "fm-mcp/AxLabelFile/LabelResources/en-US/fm-mcp.en-US.label.txt",
    "fm-mcp/AxMenuExtension/ProcurementAndSourcing.ConExtension.xml",
    "fm-mcp/AxMenuItemDisplay/ConVendCertificate.xml",
    "fm-mcp/AxSecurityPrivilege/ConVendCertificateMaintain.xml",
    "fm-mcp/AxSecurityPrivilege/ConVendCertificateView.xml",
    "fm-mcp/AxTable/ConVendCertificate.xml"
  ],
  "build": {
    "ok": true,
    "errorCount": 0,
    "errors": [],
    "durationMs": 15556
  },
  "rework": {
    "toolErrors": 5,
    "mcpToolErrors": 0,
    "toolErrorsByTool": {
      "PowerShell": 1,
      "Bash": 4
    },
    "buildAttempts": 3,
    "buildFailures": 2,
    "writeOps": 15,
    "rewrites": 2
  },
  "quality": {
    "xmlInvalid": [],
    "bp": {
      "errors": 0,
      "warnings": 25,
      "findings": [
        "Warning BPErrorLabelIsText SecurityPrivilege/ConVendCertificateMaintain",
        "Warning BPErrorLabelIsText SecurityPrivilege/ConVendCertificateMaintain",
        "Warning BPErrorPrivilegeNotCoveredByDuty SecurityPrivilege/ConVendCertificateMaintain",
        "Warning BPErrorLabelIsText SecurityPrivilege/ConVendCertificateView",
        "Warning BPErrorLabelIsText SecurityPrivilege/ConVendCertificateView",
        "Warning BPErrorPrivilegeNotCoveredByDuty SecurityPrivilege/ConVendCertificateView",
        "Warning BPErrorHelpIsText MenuItemDisplay/ConVendCertificate",
        "Warning BPErrorHelpIsText EdtString/ConVendCertificateId",
        "Warning BPErrorLabelIsText EdtString/ConVendCertificateId",
        "Warning BPErrorHelpIsText Enum/ConVendCertificateType",
        "Warning BPErrorLabelIsText Enum/ConVendCertificateType",
        "Warning BPErrorLabelIsText Form/ConVendCertificate/FormDesign/FormDesign",
        "Warning BPErrorTablePrimaryKeyEditable Table/ConVendCertificate/TableIndex/VendCertificateIdx/TableIndexField/VendAccount",
        "Warning BPErrorTablePrimaryKeyEditable Table/ConVendCertificate/TableIndex/VendCertificateIdx/TableIndexField/CertificateId",
        "Warning BPErrorHelpIsText Table/ConVendCertificate/TableFieldString/CertificateId"
      ]
    }
  }
}
