{
  "schemaVersion": 1,
  "runId": "2026-10-10T20-54__ref-credit-hold-extension__claude-code__claude-opus-5-5__plain__7e491a",
  "timestamp": "2026-10-10T20:54:01.483Z",
  "promptId": "ref-credit-hold-extension",
  "promptHash": "4019f14c8d09",
  "host": "claude-code",
  "model": "claude-opus-5-5",
  "modelRequested": "opus",
  "mcp": false,
  "mcpServers": [],
  "serverVersion": null,
  "serverGitSha": null,
  "label": "v5",
  "durationMs": 154505,
  "apiMs": 118444,
  "requests": 29,
  "toolCalls": 28,
  "mcpToolCalls": 0,
  "tools": {
    "PowerShell": 1,
    "Glob": 3,
    "Read": 7,
    "Grep": 9,
    "Write": 6,
    "Bash": 2
  },
  "inputTokens": 870064,
  "cachedTokens": 817711,
  "outputTokens": 11836,
  "hostCost": {
    "value": 0.8189422,
    "unit": "USD"
  },
  "aic": {
    "value": 81.89422,
    "source": "host-cost"
  },
  "outcome": "completed",
  "score": 1,
  "checks": [
    {
      "name": "matches McpCreditHoldReason",
      "passed": true
    },
    {
      "name": "matches SalesTableMcpCreditHold_Extension",
      "passed": true
    },
    {
      "name": "file extensible enum McpCreditHoldReason",
      "passed": true
    },
    {
      "name": "file CustTable extension: 3 fields + field group",
      "passed": true
    },
    {
      "name": "file CustTable form extension shows the group",
      "passed": true
    },
    {
      "name": "file ModifiedField event handler",
      "passed": true
    },
    {
      "name": "file SalesTable CoC on validateWrite",
      "passed": true
    },
    {
      "name": "file labels added to the model's label file",
      "passed": true
    },
    {
      "name": "written XML is well-formed",
      "passed": true
    },
    {
      "name": "builds clean (xppc)",
      "passed": true
    },
    {
      "name": "no new best-practice errors (xppbp)",
      "passed": true
    }
  ],
  "resultChars": 2216,
  "resultExcerpt": "The model builds: the benchmark build script reported **0 errors** (labels plus the xppc full build), and the compiled output includes the `validateWrite` Chain of Command wrapper. I haven't run anything in the application itself.\n\nObjects created or changed:\n\n- `AxLabelFile` **BenchmarkTestMcp** (en-US) – changed: added 13 labels for the enum, its values, field labels, help texts, the field group",
  "notes": "2 permission denial(s): PowerShell, Bash",
  "evidence": {
    "sessionId": "96d19a05-d584-4379-9fce-0899961251ce",
    "logPath": null
  },
  "artifacts": [
    "BenchmarkTestMcp/AxClass/McpCustTableEventHandler.xml",
    "BenchmarkTestMcp/AxClass/SalesTableMcpCreditHold_Extension.xml",
    "BenchmarkTestMcp/AxEnum/McpCreditHoldReason.xml",
    "BenchmarkTestMcp/AxFormExtension/CustTable.BenchmarkTestMcp.xml",
    "BenchmarkTestMcp/AxLabelFile/LabelResources/en-US/BenchmarkTestMcp.en-US.label.txt",
    "BenchmarkTestMcp/AxTableExtension/CustTable.BenchmarkTestMcp.xml"
  ],
  "build": {
    "ok": true,
    "errorCount": 0,
    "errors": [],
    "durationMs": 15815
  },
  "rework": {
    "toolErrors": 2,
    "mcpToolErrors": 0,
    "toolErrorsByTool": {
      "PowerShell": 1,
      "Bash": 1
    },
    "buildAttempts": 1,
    "buildFailures": 0,
    "writeOps": 6,
    "rewrites": 0
  },
  "quality": {
    "xmlInvalid": [],
    "bp": {
      "errors": 0,
      "warnings": 0,
      "findings": []
    }
  }
}
