{
  "schemaVersion": 1,
  "runId": "2026-10-09T16-05__ref-vendor-certificate-register__claude-code__claude-sonnet-5-5__plain__2a327f",
  "timestamp": "2026-10-09T16:05:52.947Z",
  "promptId": "ref-vendor-certificate-register",
  "promptHash": "274a0c3364a6",
  "host": "claude-code",
  "model": "claude-sonnet-5-5",
  "modelRequested": "sonnet",
  "mcp": false,
  "mcpServers": [],
  "serverVersion": null,
  "serverGitSha": null,
  "label": "v3",
  "durationMs": 230036,
  "apiMs": 156990,
  "requests": 54,
  "toolCalls": 53,
  "mcpToolCalls": 0,
  "tools": {
    "PowerShell": 1,
    "Glob": 3,
    "Read": 14,
    "Bash": 7,
    "Grep": 12,
    "Write": 11,
    "Edit": 5
  },
  "inputTokens": 1277394,
  "cachedTokens": 1222937,
  "outputTokens": 19971,
  "hostCost": {
    "value": 0.6620254,
    "unit": "USD"
  },
  "aic": {
    "value": 66.20254,
    "source": "host-cost"
  },
  "outcome": "completed",
  "score": 1,
  "checks": [
    {
      "name": "matches ConVendCertificate",
      "passed": true
    },
    {
      "name": "file string EDT ConVendCertificateId",
      "passed": true
    },
    {
      "name": "file extensible enum ConVendCertificateType",
      "passed": true
    },
    {
      "name": "file table: fields, primary index, VendTable relation, find/exist/validateWrite",
      "passed": true
    },
    {
      "name": "file SimpleList form over the table",
      "passed": true
    },
    {
      "name": "file display menu item",
      "passed": true
    },
    {
      "name": "file ProcurementAndSourcing menu extension",
      "passed": true
    },
    {
      "name": "file maintain privilege (delete)",
      "passed": true
    },
    {
      "name": "file view privilege (read only)",
      "passed": true
    },
    {
      "name": "file VendTable form extension opens the register",
      "passed": true
    },
    {
      "name": "file labels added to the model's label file",
      "passed": true
    },
    {
      "name": "written XML is well-formed",
      "passed": true
    },
    {
      "name": "builds clean (xppc)",
      "passed": true
    },
    {
      "name": "no new best-practice errors (xppbp)",
      "passed": true
    }
  ],
  "resultChars": 1933,
  "resultExcerpt": "The `fm-mcp` model builds with 0 errors using the exact `benchmarkSandboxBuild.mjs` command. I didn't open the form in a client, so the vendor filter from the VendTable button is untested at runtime.\n\nObjects created or changed:\n- `fm-mcp.en-US.label.txt` (changed): added the labels used by the new objects (types, field labels, help texts, the validation error, menu item and privilege labels)\n- `C",
  "notes": "3 permission denial(s): PowerShell, Bash, Bash",
  "evidence": {
    "sessionId": "14996dc0-8418-4787-80c8-1eadc263fdc9",
    "logPath": null
  },
  "artifacts": [
    "fm-mcp/AxEdt/ConVendCertificateId.xml",
    "fm-mcp/AxEnum/ConVendCertificateType.xml",
    "fm-mcp/AxForm/ConVendCertificate.xml",
    "fm-mcp/AxFormExtension/VendTable.ConExtension.xml",
    "fm-mcp/AxLabelFile/LabelResources/en-US/fm-mcp.en-US.label.txt",
    "fm-mcp/AxMenuExtension/ProcurementAndSourcing.ConExtension.xml",
    "fm-mcp/AxMenuItemDisplay/ConVendCertificate.xml",
    "fm-mcp/AxSecurityPrivilege/ConVendCertificateMaintain.xml",
    "fm-mcp/AxSecurityPrivilege/ConVendCertificateView.xml",
    "fm-mcp/AxTable/ConVendCertificate.xml"
  ],
  "build": {
    "ok": true,
    "errorCount": 0,
    "errors": [],
    "durationMs": 15916
  },
  "rework": {
    "toolErrors": 4,
    "mcpToolErrors": 0,
    "toolErrorsByTool": {
      "PowerShell": 1,
      "Bash": 3
    },
    "buildAttempts": 3,
    "buildFailures": 2,
    "writeOps": 16,
    "rewrites": 4
  },
  "quality": {
    "xmlInvalid": [],
    "bp": {
      "errors": 0,
      "warnings": 29,
      "findings": [
        "Warning BPErrorLabelIsText SecurityPrivilege/ConVendCertificateMaintain",
        "Warning BPErrorPrivilegeNotCoveredByDuty SecurityPrivilege/ConVendCertificateMaintain",
        "Warning BPErrorLabelIsText SecurityPrivilege/ConVendCertificateView",
        "Warning BPErrorPrivilegeNotCoveredByDuty SecurityPrivilege/ConVendCertificateView",
        "Warning BPErrorHelpIsText EdtString/ConVendCertificateId",
        "Warning BPErrorLabelIsText EdtString/ConVendCertificateId",
        "Warning BPErrorLabelIsText Enum/ConVendCertificateType",
        "Warning BPErrorLabelIsText Form/ConVendCertificate/FormDesign/FormDesign",
        "BestPractices Warning: AxTable dynamics://Table/ConVendCertificate: The index 'CertificateIdx' specified as Primary key on table 'ConVendCertificate' is not des",
        "Warning BPErrorEDTNotMigrated Table/ConVendCertificate/TableFieldString/VendAccount",
        "Warning BPErrorTableMissingGroupAutoReport Table/ConVendCertificate",
        "Warning BPErrorTableTitleField1NotDeclared Table/ConVendCertificate",
        "Warning BPErrorTablePrimaryKeyEditable Table/ConVendCertificate/TableIndex/CertificateIdx/TableIndexField/VendAccount",
        "Warning BPErrorTablePrimaryKeyEditable Table/ConVendCertificate/TableIndex/CertificateIdx/TableIndexField/CertificateId",
        "Warning BPErrorHelpIsText Table/ConVendCertificate/TableFieldString/CertificateId"
      ]
    }
  }
}
