{
  "schemaVersion": 1,
  "runId": "2026-10-09T14-44__daily-credit-limit-trace__claude-code__claude-sonnet-5-5__plain__a3ddea",
  "timestamp": "2026-10-09T14:44:25.042Z",
  "promptId": "daily-credit-limit-trace",
  "promptHash": "48edfe0c4c84",
  "host": "claude-code",
  "model": "claude-sonnet-5-5",
  "modelRequested": "sonnet",
  "mcp": false,
  "mcpServers": [],
  "serverVersion": null,
  "serverGitSha": null,
  "label": "v3",
  "durationMs": 95876,
  "apiMs": 53344,
  "requests": 23,
  "toolCalls": 22,
  "mcpToolCalls": 0,
  "tools": {
    "Grep": 12,
    "Read": 8,
    "Bash": 2
  },
  "inputTokens": 367842,
  "cachedTokens": 344070,
  "outputTokens": 5836,
  "hostCost": {
    "value": 0.222218,
    "unit": "USD"
  },
  "aic": {
    "value": 22.2218,
    "source": "host-cost"
  },
  "outcome": "completed",
  "score": 1,
  "checks": [
    {
      "name": "matches \\bCustCreditLimit\\b",
      "passed": true
    },
    {
      "name": "matches \\b(checkAgainstCreditLimit|checkCreditLimit)\\b",
      "passed": true
    },
    {
      "name": "matches \\bSalesFormletterProvider\\b",
      "passed": true
    },
    {
      "name": "matches \\b(creditMaxOk|mustCheckCreditLimit)\\b",
      "passed": true
    },
    {
      "name": "matches (CustCreditLimit\\W{1,3}(check|checkGivenBalances)\\b|\\bcheckGivenBalances\\b)",
      "passed": true
    }
  ],
  "resultChars": 3852,
  "resultExcerpt": "I traced the check through the metadata and have what I need for the answer. I did not change any file.\n\n**1. Class that performs the check**\n- The class is `CustCreditLimit`. It is in ApplicationSuite/Foundation.\n- `CustCreditLimit::construct(Common, SalesTotals)` returns a subclass by buffer table. `SalesTable` gets `CustCreditLimit_SalesTable`, `SalesParmTable` gets `CustCreditLimit_SalesParmTa",
  "notes": "1 permission denial(s): Bash",
  "evidence": {
    "sessionId": "f1c38b56-eaae-404e-8208-6acf65729478",
    "logPath": null
  },
  "rework": {
    "toolErrors": 2,
    "mcpToolErrors": 0,
    "toolErrorsByTool": {
      "Grep": 1,
      "Bash": 1
    },
    "buildAttempts": 0,
    "buildFailures": 0,
    "writeOps": 0,
    "rewrites": 0
  }
}
